{
  "$schema": "schema.json",
  "avatar": "https://github.com/andrew1412/website/raw/main/static/logos/pfp-1.webp",
  "username": "Andrew 1412",
  "links": [{ "url": "/blog", "title": "Blog" }],
  "bio": "üêà‚Äç‚¨õ Vtuber",
  "location": "Chile",
  "socialAccounts": {
    "github": "https://github.com/andrew1412",
    "youtube": "https://youtube.com/@andrew1412",
    "odysee": "https://odysee.com/@andrew1412"
  },
  "banner": {
    "title": "Nuevo blog!",
    "text": "Ahora puedes entrar a mi blog y estar al d√≠a con lo que publico."
  },
  "rss": "https://www.youtube.com/feeds/videos.xml?channel_id=UCZfSAkMNwkQBzzE8sm1gr9g",
  "readme": "https://raw.githubusercontent.com/andrew1412/website/main/about/sobre-mi.md"
}
