{
  "$schema": "schema.json",
  "avatar": "https://github.com/andrew1412/website/raw/main/static/logos/andrew1412.pfp.glasses.webp",
  "username": "Blog",
  "links": [
    { "url": "https://example.com", "title": "Blog" },
    { "url": "https://example.com", "title": "Dibujos" },
    { "url": "https://example.com", "title": "Fotos" }
  ],
  "bio": "Posts",
  "location": "Chile",
  "socialAccounts": {
    "github": "https://github.com/andrew1412",
    "youtube": "https://youtube.com/c/andrew1412",
    "twitter": "https://twitter.com/",
    "mail": "unserhumanomas@proton.me"
  },
  "banner": {
    "title": "Nuevo blog!",
    "text": "Ahora puedes entrar a mi blog y estar al d√≠a con lo que publico."
  },
  "rss": "https://www.nasa.gov/rss/dyn/breaking_news.rss",
  "readme": "https://gist.githubusercontent.com/DomPizzie/7a5ff55ffa9081f2de27c315f5018afc/raw/d59043abbb123089ad6602aba571121b71d91d7f/README-Template.md"
}
